{
  "governance_action_ref": "governance_action-de31d587f2da4003a1b2ef8e5248f846",
  "matter_ref": "matter-3ce8d00d4a614161a2fec07aeb4ff282",
  "predecessor_turn_ref": "continuity-turn-c57057fad48b434688ea85085a6fe305",
  "recorded_at": "2026-04-02T11:41:55Z",
  "state_ref": "state-31d3f49505f441f88bac51cf8531e7f7",
  "transition_ref": "transition-496f0f7964f54b858eb08a6516693d11",
  "turn_id": "continuity-turn-ebf2100d87e54394acd0ffd8e268df03",
  "validation_ref": "validation-7218a89d58ce4933bc437ef66ea9a7de",
  "witness_ref": "witness-21b189a37b9e44f0915135b6aa0cce31"
}
